{"assumptions":["declared single-evaluator model"],"claim_id":"composition-privacy","code_digest":null,"evidence_paths":["research/assurance/composition.json"],"id":"assurance.composition","implementation_refinement":"tested_differential","origin":"solver_executed","outcome":"proved_in_model","schema_version":"pllm.assurance_result.v1","scope":"masked-linear@1/core-wrap32@1","tool":"fixture-checker","tool_version":"1"}
